{
  "id": "detail-sport-ppf-exterior-immortal-cut-2026-06-25",
  "client": "Detail Sport",
  "project": "Campaña de instalación de PPF exterior con Immortal Cut",
  "date": "2026-06-25",
  "audience": {
    "label": "Hombres",
    "age_range": "25–65"
  },
  "summary": "Instalación profesional de PPF exterior para proteger la pintura del vehículo con corte preciso Immortal Cut e instalación cuidadosa.",
  "recording_instructions": "Hable despacio y con pausas. Deje un segundo de silencio antes y después de cada frase para facilitar los cortes en edición.",
  "aperturas": [
    {
      "id": "apertura-01",
      "text": "¿Quiere proteger la pintura de su auto antes de que se desgaste?",
      "label": "Pintura protegida"
    },
    {
      "id": "apertura-02",
      "text": "Su auto está expuesto todos los días a piedras, rayones, marcas y desgaste.",
      "label": "Daño diario"
    },
    {
      "id": "apertura-03",
      "text": "Cuando se trata de proteger su pintura, la instalación tiene que hacerse bien.",
      "label": "Instalación correcta"
    }
  ],
  "beneficios": [
    {
      "id": "beneficio-01",
      "text": "En Detail Sport, tenemos más de 10 años de experiencia instalando PPF.",
      "label": "Experiencia"
    },
    {
      "id": "beneficio-02",
      "text": "Detail Sport representa el sistema Immortal de CarPro en Ecuador.",
      "label": "CarPro Immortal"
    },
    {
      "id": "beneficio-03",
      "text": "La capa transparente ayuda a proteger su auto sin cambiar su estilo original.",
      "label": "Protección transparente"
    },
    {
      "id": "beneficio-04",
      "text": "Todas nuestras instalaciones de PPF cuentan con 10 años de garantía.",
      "label": "Garantía"
    }
  ],
  "modifiers": [
    {
      "id": "modifier-01",
      "label": "CarPro / Immortal Cut",
      "variations": [
        {
          "id": "modifier-01-variation-01",
          "text": "Diseñamos el corte exacto para su auto con Immortal Cut, sin pasar cuchillas sobre su pintura.",
          "label": "M1A"
        },
        {
          "id": "modifier-01-variation-02",
          "text": "Con Immortal Cut, cada pieza se corta a medida para su vehículo, sin usar cuchillas directamente sobre la pintura.",
          "label": "M1B"
        },
        {
          "id": "modifier-01-variation-03",
          "text": "El corte se prepara con precisión para su auto, cuidando su pintura desde el primer paso.",
          "label": "M1C"
        }
      ],
      "usage": "Use when showing software, plotter, digital cutting, or explaining that the cut is prepared without blades on the paint."
    },
    {
      "id": "modifier-02",
      "label": "Instalación panel por panel",
      "variations": [
        {
          "id": "modifier-02-variation-01",
          "text": "Nuestros técnicos instalan el PPF cuidadosamente, panel por panel.",
          "label": "M2A"
        },
        {
          "id": "modifier-02-variation-02",
          "text": "Cada panel se trabaja con calma, precisión y cuidado durante la instalación.",
          "label": "M2B"
        },
        {
          "id": "modifier-02-variation-03",
          "text": "La instalación se realiza pieza por pieza, cuidando el acabado de cada zona.",
          "label": "M2C"
        }
      ],
      "usage": "Use when showing technicians installing the PPF carefully on the vehicle."
    }
  ],
  "ctas": [
    {
      "id": "cta-01",
      "text": "Escríbanos y revisamos qué protección le conviene a su vehículo.",
      "label": "Revisión"
    },
    {
      "id": "cta-02",
      "text": "Visítenos en Detail Sport y le ayudamos con lo que necesite.",
      "label": "Visita al local"
    },
    {
      "id": "cta-03",
      "text": "Contáctenos para más información sobre nuestro servicio de PPF.",
      "label": "Información"
    }
  ],
  "visual_notes": [
    "Mostrar el software o preparación de corte Immortal Cut cuando se use el modificador M1.",
    "Mostrar instalación cuidadosa sobre el vehículo cuando se use el modificador M2.",
    "Usar close-ups de pintura, bordes, puntos de contacto y acabado transparente.",
    "Cerrar con beauty shot del auto terminado, logo, teléfono y ubicación."
  ],
  "audio_notes": [
    "Grabar A, B, M y C como clips independientes.",
    "Usar modificadores solo cuando el edit necesite más duración o cuando el footage muestre ese proceso.",
    "Mantener tono natural, claro y profesional."
  ],
  "internal_notes": [],
  "client_notes": []
}
