{
  "id": "detail-sport-ppf-immortal-cut-2026-06-11",
  "client": "Detail Sport",
  "project": "Campaña de instalación de PPF con sistema Immortal Cut de CarPro",
  "date": "2026-06-11",
  "audience": {
    "label": "Hombres",
    "age_range": "25–65"
  },
  "summary": "Instalación profesional de PPF para proteger pintura, bordes, interiores y zonas de contacto del vehículo.",
  "recording_instructions": "Hable despacio y con pausas. Deje un segundo de silencio antes y después de cada frase para facilitar los cortes en edición.",
  "aperturas": [
    {
      "id": "apertura-01",
      "text": "¿Quiere proteger la pintura de su vehículo antes de que se desgaste?",
      "label": "Pregunta"
    },
    {
      "id": "apertura-02",
      "text": "Su vehículo está expuesto todos los días a rayones, piedras, marcas y desgaste.",
      "label": "Exposición diaria"
    },
    {
      "id": "apertura-03",
      "text": "El PPF protege las zonas más vulnerables de su auto sin cambiar su estilo original.",
      "label": "Protección invisible"
    }
  ],
  "beneficios": [
    {
      "id": "beneficio-01",
      "text": "El PPF ayuda a proteger la pintura del desgaste diario y los rayones.",
      "label": "Rayones"
    },
    {
      "id": "beneficio-02",
      "text": "La instalación de PPF actúa como una barrera protectora, protegiendo a su auto de los elementos.",
      "label": "Barrera protectora"
    },
    {
      "id": "beneficio-03",
      "text": "El PPF le ayuda a mantener su auto en perfectas condiciones y además protege su valor de reventa.",
      "label": "Valor de reventa"
    }
  ],
  "modifiers": [
    {
      "id": "modifier-01",
      "label": "Immortal Cut / Sin cuchillas",
      "variations": [
        {
          "id": "modifier-01-variation-01",
          "text": "Diseñamos el corte exacto para su auto con Immortal Cut, sin pasar cuchillas sobre su pintura.",
          "label": "M1A"
        },
        {
          "id": "modifier-01-variation-02",
          "text": "Con Immortal Cut, cada pieza se corta a medida para su vehículo, sin usar cuchillas directamente sobre la pintura.",
          "label": "M1B"
        },
        {
          "id": "modifier-01-variation-03",
          "text": "El corte se prepara con precisión para su auto, cuidando su pintura desde el primer paso.",
          "label": "M1C"
        }
      ],
      "usage": "Use when showing digital cut preparation, software, plotter, or no-blade installation proof."
    },
    {
      "id": "modifier-02",
      "label": "Instalación panel por panel",
      "variations": [
        {
          "id": "modifier-02-variation-01",
          "text": "Nuestros técnicos instalan el PPF cuidadosamente, panel por panel.",
          "label": "M2A"
        },
        {
          "id": "modifier-02-variation-02",
          "text": "Cada panel se trabaja con calma, precisión y cuidado durante la instalación.",
          "label": "M2B"
        },
        {
          "id": "modifier-02-variation-03",
          "text": "La instalación se realiza pieza por pieza, cuidando el acabado de cada zona.",
          "label": "M2C"
        }
      ],
      "usage": "Use when showing technicians installing PPF carefully on the vehicle."
    },
    {
      "id": "modifier-03",
      "label": "Garantía",
      "variations": [
        {
          "id": "modifier-03-variation-01",
          "text": "Todas nuestras instalaciones de PPF cuentan con 10 años de garantía.",
          "label": "M3A"
        },
        {
          "id": "modifier-03-variation-02",
          "text": "Su instalación de PPF queda respaldada con 10 años de garantía.",
          "label": "M3B"
        },
        {
          "id": "modifier-03-variation-03",
          "text": "Además, este servicio cuenta con una garantía de 10 años.",
          "label": "M3C"
        }
      ],
      "usage": "Use when the edit needs a trust or warranty insert."
    }
  ],
  "ctas": [
    {
      "id": "cta-01",
      "text": "Contáctenos para solicitar su cotización.",
      "label": "Cotización"
    },
    {
      "id": "cta-02",
      "text": "Proteja su vehículo con PPF profesional. Escríbanos y agende su asesoría.",
      "label": "Asesoría"
    },
    {
      "id": "cta-03",
      "text": "Contáctenos para más información sobre nuestro servicio de PPF con garantía.",
      "label": "Garantía"
    }
  ],
  "visual_notes": [],
  "audio_notes": [],
  "internal_notes": [
    "This content came from the old file named detail-sport-campana-pulido-y-proteccion-ceramica-con-productos-carpro-2026-06-08-1133.html, but the actual campaign content is PPF, not ceramic coating."
  ],
  "client_notes": []
}
